{
  "created_at_utc": "2026-08-16T04:00:00Z",
  "evidence_ledger_path": "candidate_outputs/evidence/evidence.jsonl",
  "jira_index_path": "candidate_outputs/jira/indexes/issues.jsonl",
  "origin": "NEW",
  "plan_catalog_path": "candidate_outputs/plans/catalog.json",
  "profile": "MACHINE_LEARNING",
  "project_id": "ppqs-03",
  "project_name": "DemandForge",
  "repositories": [
    {
      "canonical_url": null,
      "repository_id": "demandforge",
      "role": "PRIMARY",
      "root_path": "."
    }
  ],
  "requirement_registry_path": "candidate_outputs/requirements.jsonl",
  "revision": 1,
  "root_path": "./workspace/PPQS-03",
  "schema_version": "1.0.0",
  "source_registry_path": "source_registry/sources.jsonl",
  "updated_at_utc": "2026-08-16T04:00:00Z"
}
